{
  "$schema": "https://json-schema.org/draft/2020-12/schema",
  "$id": "https://github.com/mehul0810/agent-harness/schemas/run-record.schema.json",
  "title": "Sanitized Agent Harness Run Record",
  "type": "object",
  "additionalProperties": false,
  "required": ["schemaVersion", "runId", "scenario", "result", "startedAt", "durationMs", "checks", "metrics"],
  "properties": {
    "$schema": { "type": "string" },
    "schemaVersion": { "const": 1 },
    "runId": { "type": "string", "pattern": "^[A-Za-z0-9][A-Za-z0-9._-]{0,127}$" },
    "scenario": { "type": "string", "minLength": 1 },
    "result": { "$ref": "#/$defs/outcome" },
    "startedAt": {
      "type": "string",
      "format": "date-time",
      "pattern": "^\\d{4}-\\d{2}-\\d{2}T\\d{2}:\\d{2}:\\d{2}\\.\\d{3}Z$"
    },
    "durationMs": { "type": "integer", "minimum": 0 },
    "durationScope": { "enum": ["full_task", "partial_observation_window", "shared_batch_interval"] },
    "checks": {
      "type": "array",
      "items": { "$ref": "#/$defs/check" }
    },
    "metrics": {
      "type": "object",
      "propertyNames": { "pattern": "^[A-Za-z0-9][A-Za-z0-9._-]{0,127}$" },
      "additionalProperties": { "type": "number" },
      "properties": {
        "input_tokens": { "$ref": "#/$defs/counter" },
        "cached_input_tokens": { "$ref": "#/$defs/counter" },
        "output_tokens": { "$ref": "#/$defs/counter" },
        "context_tokens_peak": { "$ref": "#/$defs/counter" },
        "tool_calls": { "$ref": "#/$defs/counter" },
        "retry_count": { "$ref": "#/$defs/counter" }
      }
    },
    "tags": {
      "type": "array",
      "uniqueItems": true,
      "items": { "type": "string", "minLength": 1 }
    },
    "lineage": { "$ref": "#/$defs/lineage" },
    "measurement": { "$ref": "#/$defs/measurement" }
  },
  "allOf": [
    {
      "if": { "properties": { "result": { "const": "succeeded" } }, "required": ["result"] },
      "then": {
        "properties": {
          "checks": {
            "minItems": 1,
            "items": { "allOf": [{ "$ref": "#/$defs/check" }, { "properties": { "result": { "const": "pass" } } }] }
          }
        }
      }
    }
  ],
  "$defs": {
    "outcome": { "enum": ["succeeded", "no-op", "blocked", "failed", "escalated"] },
    "counter": { "type": "integer", "minimum": 0, "maximum": 9007199254740991 },
    "checkResult": { "enum": ["pass", "fail", "error"] },
    "check": {
      "type": "object",
      "additionalProperties": false,
      "required": ["name", "result"],
      "properties": {
        "name": { "type": "string", "minLength": 1 },
        "result": { "$ref": "#/$defs/checkResult" },
        "message": { "type": "string", "maxLength": 500 }
      }
    },
    "lineage": {
      "type": "object",
      "additionalProperties": false,
      "minProperties": 1,
      "properties": {
        "observationId": { "$ref": "#/$defs/pointer" },
        "workItemId": { "$ref": "#/$defs/pointer" },
        "decisionId": { "$ref": "#/$defs/pointer" },
        "actionId": { "$ref": "#/$defs/pointer" },
        "verificationId": { "$ref": "#/$defs/pointer" },
        "learningCandidateId": { "$ref": "#/$defs/pointer" },
        "artifactPointer": { "$ref": "#/$defs/pointer" }
      }
    },
    "measurement": {
      "type": "object",
      "additionalProperties": false,
      "required": ["status"],
      "properties": {
        "status": { "enum": ["pending", "met", "missed", "inconclusive", "not_applicable"] },
        "windowEndsAt": { "type": ["string", "null"], "format": "date-time", "pattern": "^\\d{4}-\\d{2}-\\d{2}T\\d{2}:\\d{2}:\\d{2}\\.\\d{3}Z$" },
        "verifiedAt": { "type": ["string", "null"], "format": "date-time", "pattern": "^\\d{4}-\\d{2}-\\d{2}T\\d{2}:\\d{2}:\\d{2}\\.\\d{3}Z$" },
        "metricNames": {
          "type": "array",
          "uniqueItems": true,
          "items": { "type": "string", "pattern": "^[A-Za-z0-9][A-Za-z0-9._-]{0,127}$" }
        },
        "summary": { "type": "string", "maxLength": 500 }
      },
      "allOf": [
        {
          "if": { "properties": { "status": { "const": "pending" } }, "required": ["status"] },
          "then": { "required": ["windowEndsAt"], "properties": { "windowEndsAt": { "type": "string", "format": "date-time", "pattern": "^\\d{4}-\\d{2}-\\d{2}T\\d{2}:\\d{2}:\\d{2}\\.\\d{3}Z$" } } }
        },
        {
          "if": { "properties": { "status": { "enum": ["met", "missed", "inconclusive"] } }, "required": ["status"] },
          "then": { "required": ["verifiedAt", "summary"], "properties": { "verifiedAt": { "type": "string", "format": "date-time", "pattern": "^\\d{4}-\\d{2}-\\d{2}T\\d{2}:\\d{2}:\\d{2}\\.\\d{3}Z$" }, "summary": { "type": "string", "minLength": 1, "maxLength": 500 } } }
        },
        {
          "if": { "properties": { "status": { "const": "not_applicable" } }, "required": ["status"] },
          "then": { "required": ["summary"], "properties": { "summary": { "type": "string", "minLength": 1, "maxLength": 500 } } }
        }
      ]
    },
    "pointer": {
      "type": "string",
      "minLength": 1,
      "maxLength": 500
    }
  }
}
