{
  "$schema": "../../schemas/run-record.schema.json",
  "schemaVersion": 1,
  "runId": "run-2026-07-14-001",
  "scenario": "happy-path",
  "result": "succeeded",
  "startedAt": "2026-07-14T05:00:00.000Z",
  "durationMs": 842,
  "checks": [
    { "name": "required-files", "result": "pass" },
    { "name": "route-budget", "result": "pass" }
  ],
  "metrics": {
    "input_tokens": 64,
    "output_tokens": 18,
    "tool_calls": 1,
    "retry_count": 0,
    "checks_passed": 2
  },
  "lineage": {
    "observationId": "obs-2026-07-14-001",
    "workItemId": "work-001",
    "decisionId": "decision-001",
    "actionId": "action-001",
    "verificationId": "verification-001"
  },
  "measurement": {
    "status": "met",
    "verifiedAt": "2026-07-14T05:01:00.000Z",
    "metricNames": ["checks_passed"],
    "summary": "The expected validation result was observed."
  },
  "tags": ["example"]
}
